[
  {
    "reference": "12345",
    "timestamp": "2020-12-11 13:24:15",
    "payment_method": "card",
    "extra_data": {
      "foo": "bar"
    }
  },
  {
    "reference": "8765432",
    "timestamp": "2020-12-11 14:42:57",
    "user_reference": "user42",
    "extra_data": {
      "foo": "baz"
    }
  }
]
